{
  "change_instance_id": "CI-20260622-001",
  "data_type": "screen_semantic_events",
  "version": "1.0",
  "description": "GUI agent 根据白屏和黑屏操作识别出的语义级事件。",
  "events": [
    {
      "event_id": "EVT-00001",
      "event_time": "2026-06-22 09:46:45",
      "actor": "张维",
      "actor_role": "执行人",
      "event_source": "监控服务页面和拨测平台",
      "semantic_action": "完成变更前运行状态检查",
      "target_object": "billing-module/cn-east-3",
      "semantic_description": "查看计量模块未闭环告警、拨测任务和关键指标，确认当前环境没有阻断本次变更的运行异常。",
      "evidence_refs": [
        {
          "evidence_type": "日志内容",
          "log_table": "white_screen",
          "log_id": "155660901",
          "time_range": "2026-06-22 09:43:10 ~ 2026-06-22 09:45:02"
        },
        {
          "evidence_type": "日志内容",
          "log_table": "white_screen",
          "log_id": "155660902",
          "time_range": "2026-06-22 09:45:18 ~ 2026-06-22 09:46:40"
        }
      ],
      "tool_unique_ids": [],
      "action_unique_ids": [],
      "tool_related_actions": [],
      "operate_commond": null,
      "command_list": [
        "https://internal-monitor.example.com/service-dashboard",
        "A-9001201-metric-delay",
        "probe-task:billing-module-cn-east-3"
      ]
    },
    {
      "event_id": "EVT-00002",
      "event_time": "2026-06-22 09:55:30",
      "actor": "张维",
      "actor_role": "执行人",
      "event_source": "自动化执行平台和变更单参数页",
      "semantic_action": "确认脚本入口和变更参数",
      "target_object": "tenanttenanttenant000231/archive",
      "semantic_description": "确认自动化脚本可用，并核对租户、商品编码、规格编码、扩展名称和上游配置准备状态。",
      "evidence_refs": [
        {
          "evidence_type": "日志内容",
          "log_table": "white_screen",
          "log_id": "155660903",
          "time_range": "2026-06-22 09:49:05 ~ 2026-06-22 09:51:44"
        },
        {
          "evidence_type": "日志内容",
          "log_table": "black_screen",
          "log_id": "MOCK-LPA-202606220950-001",
          "time_range": "2026-06-22 09:50:00 ~ 2026-06-22 09:50:59"
        },
        {
          "evidence_type": "日志内容",
          "log_table": "white_screen",
          "log_id": "155660904",
          "time_range": "2026-06-22 09:52:21 ~ 2026-06-22 09:55:15"
        }
      ],
      "tool_unique_ids": [
        "auto_platform"
      ],
      "action_unique_ids": [
        "svc_cfg_cli_runner"
      ],
      "tool_related_actions": [
        {
          "tool_unique_id": "auto_platform",
          "action_unique_id": "svc_cfg_cli_runner"
        }
      ],
      "operate_commond": "svc_cfg_cli_runner",
      "command_list": [
        "svc_cfg_cli_runner --describe billing-module extendChargeItem"
      ]
    },
    {
      "event_id": "EVT-00003",
      "event_time": "2026-06-22 10:14:55",
      "actor": "张维",
      "actor_role": "执行人",
      "event_source": "自动化执行平台和堡垒机",
      "semantic_action": "提交增程商品创建任务",
      "target_object": "tenanttenanttenant000231/archive",
      "semantic_description": "通过自动化平台执行配置脚本，为目标租户添加 archive 增程商品配置。",
      "evidence_refs": [
        {
          "evidence_type": "日志内容",
          "log_table": "white_screen",
          "log_id": "155660905",
          "time_range": "2026-06-22 10:10:32 ~ 2026-06-22 10:11:48"
        },
        {
          "evidence_type": "日志内容",
          "log_table": "black_screen",
          "log_id": "MOCK-LPA-202606221014-002",
          "time_range": "2026-06-22 10:14:00 ~ 2026-06-22 10:14:59"
        }
      ],
      "tool_unique_ids": [
        "auto_platform"
      ],
      "action_unique_ids": [
        "svc_cfg_cli_runner"
      ],
      "tool_related_actions": [
        {
          "tool_unique_id": "auto_platform",
          "action_unique_id": "svc_cfg_cli_runner"
        }
      ],
      "operate_commond": "svc_cfg_cli_runner",
      "command_list": [
        "svc_cfg_cli_runner svc_cli_user Q0xJX0NSRUQtY2UzLTAwMQ== billing-module add extendChargeItem tenanttenanttenant000231||archive||ext.archive.type2||archive-ext"
      ]
    },
    {
      "event_id": "EVT-00004",
      "event_time": "2026-06-22 10:23:40",
      "actor": "张维",
      "actor_role": "执行人",
      "event_source": "自动化执行平台和堡垒机",
      "semantic_action": "确认配置已写入目标节点",
      "target_object": "billing-ce3-prod-a/extension_item_mapping.json",
      "semantic_description": "批量查询目标集群计量组件节点的配置文件，确认 archive 配置已经写入多节点。",
      "evidence_refs": [
        {
          "evidence_type": "日志内容",
          "log_table": "white_screen",
          "log_id": "155660906",
          "time_range": "2026-06-22 10:22:10 ~ 2026-06-22 10:23:27"
        },
        {
          "evidence_type": "日志内容",
          "log_table": "black_screen",
          "log_id": "MOCK-LPA-202606221021-003",
          "time_range": "2026-06-22 10:21:00 ~ 2026-06-22 10:21:59"
        }
      ],
      "tool_unique_ids": [
        "auto_platform"
      ],
      "action_unique_ids": [
        "grep_config_snapshot"
      ],
      "tool_related_actions": [
        {
          "tool_unique_id": "auto_platform",
          "action_unique_id": "grep_config_snapshot"
        }
      ],
      "operate_commond": "cluster_parallel_grep",
      "command_list": [
        "cluster_parallel_grep billing-ce3-prod-a 'grep -A 3 \"tenanttenanttenant000231:archive\" /opt/app/service_layer/component/config/extension_item_mapping.json'"
      ]
    },
    {
      "event_id": "EVT-00005",
      "event_time": "2026-06-22 11:13:45",
      "actor": "李配",
      "actor_role": "配合人",
      "event_source": "监控服务页面",
      "semantic_action": "完成变更后运行状态复查",
      "target_object": "billing-module/cn-east-3",
      "semantic_description": "变更后重新检查计量延迟告警、拨测任务和关键指标，未发现运行状态异常。",
      "evidence_refs": [
        {
          "evidence_type": "日志内容",
          "log_table": "white_screen",
          "log_id": "155660907",
          "time_range": "2026-06-22 11:11:04 ~ 2026-06-22 11:13:36"
        }
      ],
      "tool_unique_ids": [],
      "action_unique_ids": [],
      "tool_related_actions": [],
      "operate_commond": null,
      "command_list": [
        "A-9001201-metric-delay",
        "probe-task:billing-module-cn-east-3"
      ]
    },
    {
      "event_id": "EVT-00006",
      "event_time": "2026-06-22 11:16:35",
      "actor": "李配",
      "actor_role": "配合人",
      "event_source": "自动化执行平台和堡垒机",
      "semantic_action": "下载业务明细文件",
      "target_object": "obs-bill-usage-ce3-a-001/2026062201",
      "semantic_description": "通过自动化平台执行业务明细下载脚本，获取目标小时的计量明细文件。",
      "evidence_refs": [
        {
          "evidence_type": "日志内容",
          "log_table": "white_screen",
          "log_id": "155660908",
          "time_range": "2026-06-22 11:15:11 ~ 2026-06-22 11:16:20"
        },
        {
          "evidence_type": "日志内容",
          "log_table": "black_screen",
          "log_id": "MOCK-LPA-202606221116-004",
          "time_range": "2026-06-22 11:16:00 ~ 2026-06-22 11:16:59"
        }
      ],
      "tool_unique_ids": [
        "auto_platform"
      ],
      "action_unique_ids": [
        "svc_usage_record_fetcher"
      ],
      "tool_related_actions": [
        {
          "tool_unique_id": "auto_platform",
          "action_unique_id": "svc_usage_record_fetcher"
        }
      ],
      "operate_commond": "svc_usage_record_fetcher",
      "command_list": [
        "svc_usage_record_fetcher obs-bill-usage-ce3-a-001 2026062201 0"
      ]
    },
    {
      "event_id": "EVT-00007",
      "event_time": "2026-06-22 11:21:12",
      "actor": "李配",
      "actor_role": "配合人",
      "event_source": "明细文件预览页和堡垒机",
      "semantic_action": "识别业务明细字段不符合预期",
      "target_object": "/tmp/usage_detail_2026062201.log",
      "semantic_description": "筛选 archive 明细记录后发现 factor 字段为 ext.archive.type3，与预期 ext.archive.type2 不一致。",
      "evidence_refs": [
        {
          "evidence_type": "日志内容",
          "log_table": "white_screen",
          "log_id": "155660909",
          "time_range": "2026-06-22 11:19:18 ~ 2026-06-22 11:21:05"
        },
        {
          "evidence_type": "日志内容",
          "log_table": "black_screen",
          "log_id": "MOCK-LPA-202606221118-005",
          "time_range": "2026-06-22 11:18:00 ~ 2026-06-22 11:18:59"
        }
      ],
      "tool_unique_ids": [
        "auto_platform"
      ],
      "action_unique_ids": [
        "usage_detail_filter"
      ],
      "tool_related_actions": [
        {
          "tool_unique_id": "auto_platform",
          "action_unique_id": "usage_detail_filter"
        }
      ],
      "operate_commond": "awk",
      "command_list": [
        "awk -F'|' '$8==\"archive\" {print $8,$13,$14}' /tmp/usage_detail_2026062201.log"
      ]
    },
    {
      "event_id": "EVT-00008",
      "event_time": "2026-06-22 11:25:55",
      "actor": "张维",
      "actor_role": "执行人",
      "event_source": "自动化执行平台和堡垒机",
      "semantic_action": "提交删除增程商品回退任务",
      "target_object": "tenanttenanttenant000231/archive",
      "semantic_description": "因业务明细字段不符合预期，通过自动化平台执行删除增程商品命令进行回退。",
      "evidence_refs": [
        {
          "evidence_type": "日志内容",
          "log_table": "white_screen",
          "log_id": "155660910",
          "time_range": "2026-06-22 11:24:07 ~ 2026-06-22 11:25:44"
        },
        {
          "evidence_type": "日志内容",
          "log_table": "black_screen",
          "log_id": "MOCK-LPA-202606221125-006",
          "time_range": "2026-06-22 11:25:00 ~ 2026-06-22 11:25:59"
        }
      ],
      "tool_unique_ids": [
        "auto_platform"
      ],
      "action_unique_ids": [
        "svc_cfg_cli_runner"
      ],
      "tool_related_actions": [
        {
          "tool_unique_id": "auto_platform",
          "action_unique_id": "svc_cfg_cli_runner"
        }
      ],
      "operate_commond": "svc_cfg_cli_runner",
      "command_list": [
        "svc_cfg_cli_runner svc_cli_user Q0xJX0NSRUQtY2UzLTAwMQ== billing-module remove extendChargeItem TenantId=tenanttenanttenant000231||ItemCode=archive"
      ]
    },
    {
      "event_id": "EVT-00009",
      "event_time": "2026-06-22 11:38:40",
      "actor": "张维",